{
  "schema_version": "1.0",
  "record_type": "memory_decision",
  "tenant_id": "018f0000-0000-7000-8000-000000000001",
  "decision_id": "018f0000-0000-7000-8000-00000000000f",
  "proposal_ref": {
    "record_type": "memory_proposal",
    "record_id": "018f0000-0000-7000-8000-00000000000d",
    "record_digest": "sha256:7e175e2e3b1f23769eaa505390c1ad9f5822cbf009b23c2a5005fd7fd10a0e34"
  },
  "disposition": "accept",
  "policy_refs": [
    {
      "record_type": "policy_proposal",
      "record_id": "018f0000-0000-7000-8000-00000000005a",
      "record_digest": "sha256:0a2e5f05be4f91c4ce301cd0d57ea112eed02bb71bad73c69f34ce3e7ca38f9c"
    }
  ],
  "rule_refs": [
    "memory.accept.v1"
  ],
  "constraints": [
    {
      "constraint_id": "example.org/max_actions",
      "constraint_version": "1.0",
      "parameters": {
        "maximum": 1
      },
      "parameters_digest": "sha256:b9ca7ee9ae24922f4b11d19ec79e26030669bc08aa62755c3702a175690dbabe"
    }
  ],
  "reason_code": "fixture.accepted",
  "actor_context_digest": "sha256:eaa0f1c67d60a24074f87d824ec6267bf04ca492ff330844c17ee715e4fa08df",
  "decided_at": "2026-01-01T00:04:00.000Z",
  "decision_digest": "sha256:acf4322fa100262d1568194c151dd3212e9251efe1e3ce04a877f64a8c5265c8"
}
